ID,course ,description
62,ARAB 201,"ARAB 201 - Issues in Contemporary Arab Culture 
This course aims to explore a number of themes related to contemporary Arab culture(s)
and further develop students’ communication skills and academic writing in Arabic.
Themes which will be examined include: Arab culture(s) and change in a globalized
world, tradition and modernity, the self and the other, dynamics of religion and
society, women and gender in a changing world, Arab youth and artistic expression."
63,PHIL 210,"PHIL 210 - Ethics
An introduction to some of the major normative ethical theories based on the study of
the original writings of selected philosophers, including a section on applied ethics."
64,INDE 301,"INDE 301 - Engineering Economy 
A course that covers principles, basic concepts and methodology for making rational
decisions in the design and implementation of real engineering projects; time value of
money, depreciation, comparing alternatives, effect of taxes, inflation, capital financing
and allocation, and decision under uncertainty."
65,INDE 410,"INDE 410  - Engineering Ethics 
A course on engineering ethics covering responsibility in engineering; framing the moral
problem; organizing principles of ethical theories; computers, individual morality and
social policy; honesty, integrity and reliability; safety, risk and liability in engineering;
engineers as employees; engineers and the environment; international engineering
professionalism; and future challenges."
66,GEOL 205,"GEOL 205 - Earth Resources and Energy
A study of the main economic mineral resources and traditional and alternate energy
resources, with an emphasis on the environmental impacts of their use and misuse. A
special emphasis is given to regional issues. Open to both arts and sciences students,
but not to Geology and Petroleum Geosciences students. "
67,MATH 251,"MATH 251 - Techniques of numerical analysis: number representations and round-off errors, root
finding, approximation of functions, integration, solving initial value problems, Monte-
Carlo methods. Implementations and analysis of the algorithms are stressed. Projects
using MATLAB or a similar tool are assigned."
